"Center","Co-ordinator","Contact Nos","Address"
"Ahmednagar Dhule Nandurbar Nashik","Dr. Rajendra S. BangalM.B.B.S M.D (Forensic Medicine) DNB LLB","{0253-2303802 2303111.|Fax: 0253-2303930}","{Address: First Floor Shreeji Milap      Plot No 52 Sector-40      Seawoods-Darave Station      Nerul (W) Navi Mumbai-400706      Maharashtra India.|}"
"Kolhapur Sangli Satara","Dr. Shekhar Kognulkar       M.B.B.S D.A D.H.A","{9850004129|02164272654}","{Address|Email: skoganulkar@yahoo.co.in      &nbsp;&nbsp;&nbsp;&nbsp;&nbsp;&nbsp;&nbsp;&nbsp;&nbsp;&nbsp;&nbsp;&nbsp;shekharkog@gmail.com}"
"Ahmednagar Aurangabad Jalgaon Jalna","Dr. Rajendra S. BangalM.B.B.S M.D (Forensic Medicine) DNB LLB","&nbsp;","Address: First Floor Shreeji Milap        Plot No 52 Sector-40        Seawoods-Darave Station        Nerul (W) Navi Mumbai-400706        Maharashtra India.         Email: kalidas_chavan2003@yahoo.com"
"&nbsp;","Dr.Numan Husaini      M.B.B.S M.D (Forensic medicine)","9860140045","Email: numan_husaini2009@rediffmail.com"
"Ahmednagar Pune","Dr.Ajay Naik      M.S (General Surgery) M.C.H      (Pediatric Surgery)","9923066734 9011534384                020-26992947","{Residence: Flat no B 303 Shatanand housing        society Gadital Hadapsar Pune 411028|Email: ajayndr@gmail.com         &nbsp;&nbsp;&nbsp;&nbsp;&nbsp;&nbsp;&nbsp;&nbsp;&nbsp;&nbsp;&nbsp;&nbsp;ajayndr1410@rediffmail.com}"
"Pimpri-Chinchwad","{Dr. Sachin Patil|M.B.B.S M.D (Radiology)}","9860111717  9325697166","Email: drpatilsachin@gmail.com       &nbsp;&nbsp;&nbsp;&nbsp;&nbsp;&nbsp;&nbsp;&nbsp;&nbsp;&nbsp;&nbsp;&nbsp;emcpcmc@gmail.com"
"Buldhana      Akola      Khamgaon      Amravati      Vashim      Chikhali","Dr.  Satish Charkha","09422162893      09970881190","Email: drsatishcharkha@rediffmail.com"
"Mumbai","Director: Dr. Ajay V. Patil      M.B.B.S M.D (Forensic Medicine) DNB","9029193969","Head Office: First Floor Shreeji Milap      Plot No 52 Sector-40      Seawoods-Darave Station      Nerul (W) Navi Mumbai-400706      Maharashtra India. 24X7 HelpLine Nos: +91-9320611111      Landline nos: +91-022-41530100  (100 Lines)      Fax :+91-022-27716787        E-Mail:  medishield.india@gmail.com"
"&nbsp;","Director: Dr. Rajendra S. Bangal      M.B.B.S M.D (Forensic Medicine) DNB LLB","9029533799","Head Office: First Floor Shreeji Milap      Plot No 52 Sector-40      Seawoods-Darave Station      Nerul (W) Navi Mumbai-400706      Maharashtra India. 24X7 HelpLine Nos: +91-9320611111      Landline nos: +91-022-41530100  (100 Lines)      Fax :+91-022-27716787        E-Mail:  medishield.india@gmail.com"
