"You may also be interested in these products","Store","Price"
"Wall Hanging: Sumersault Spotted Ellie Wall Hanging Cream/Chocolate/BlueFind wall decorations to suit your style at Target.com! Sumersault spotted ellie wall hanging cream/chocolate/blue Read MoreFree Shipping On Orders $50+","Target.com","{$29.74|Save 15%}"
"Diaper Stackers: Sumersault Spotted Hippo Diaper StackerFind diaper bags and storage at Target.com! This cute diaper stacker by sumersault is perfect for any nursery. It has a ... Read MoreFree Shipping On Orders $50+","Target.com","$27.99"
"Sumersault 123 Go Diaper StackerSumersault baby gear is easy and accessible. Featuring a fun pin-stripe pattern and a flying plane applique this boys' ... Read MoreFree Shipping on $75. Valid 5.","NULL","{$32.29|Save 14%}"
"Ellie & Stretch Diaper Stacker by Glenna JeanYou've bought the set why not complete it? Accessorize your baby's nursery with the Ellie & Stretch Diaper Stacker by ... Read More","Bunnyberry","{$49.99|Save 17%}"
"Cotton Tale Cupcake Diaper Stacker (Pink )This adorable Cupcake diaper stacker by Cotton Tale features a pink and brown shirt stripe pattern. The diaper stacker ... Read More","Overstock","$34.99"
"Newborn Multi On-the-move Diaper StackerNeatly store all of baby's diapers in our super-cute convenient stacker![*-Crisp cotton poplin with rib-knit trim*-Two ... Read More","The Children's Place","{$18.95|Save 5%}"
"Newborn Multi Butterfly Diaper StackerNeatly store all of baby's diapers in our super-cute convenient stacker![*-Crisp cotton poplin with rib-knit trim*-Two ... Read More","The Children's Place","{$18.95|Save 5%}"
"Diaper Stackers: Cotton Tale Lollipops and Roses Diaper Stacker: WhitePinkFind diaper bags and storage at Target.com! Cotton tale lollipops and roses diaper stacker - whitepink (20x11) Read MoreFree Shipping On Orders $50+","Target.com","{$36.09|Save 14%}"
"Diaper Stackers: Sumersault Sasha Diaper StackerFind diaper bags and storage at Target.com! Bring some extra charm and order to your nursery with this diaper stacker ... Read MoreFree Shipping On Orders $50+","Target.com","{$23.79|Save 15%}"
