"{charming d in alpharetta georgia|updated 6 months ago}","{can i have some input please on how to organize labwork.       - 3 replies|i just started working w/ my dh in his office i don't have any experiece working in an office and it's just me and him alone working together. yeah...}"
"w c 77 in charlotte north carolina","{are there bonuses for office managers?|i am wondering if office managers get bonuses from corporation/hospital owned practices for saving money or making a profit for example. i have...}"
"{jklsnf'; in charlotte north carolina|updated 18 months ago}","{question for medical office managers       - 2 replies|do you consider benefit verification as experience in hiring for your billing department?}"
"maureen in danbury connecticut","{on the job training|i started working part time at chiropractor's office last month with no previous experience in a medical office.  he has one other office employee...}"
"{mary in sussex wisconsin|updated 33 months ago}","{getting a medical office manager job.       - 5 replies|how did you get your start doing medical office manager work and what career moves did you make to get to your current position?do you need a...}"
"{sidra in west palm beach florida|updated 35 months ago}","{charging a minimum copay- read more       - 2 replies|my director over our hospital owned clinic suggested we collect a minimum copay of 10.00 from people we aren't able to receive benefit information...}"
"{els in lawrenceville georgia|updated 50 months ago}","{what are typical medical office manager salaries?       - 3 replies|do some companies pay a lot more for this position than others? what does a top earner make in this field?what skills should you learn to increase...}"
"{terry in ardmore pennsylvania|updated 65 months ago}","{top medical office manager skills needed to get the job.       - 1 reply|what are the top 3 traits or skills every medical office manager must have to excel?can you suggest any tips or insights to develop your medical...}"
"host","{what do you enjoy most about your medical office manager career?|what do you enjoy most about being a medical office manager?   what do you dislike the most?  is it challenging? are there many opportunities to...}"
"host","{are medical office manager job opportunities growing or declining?|are jobs in this industry on the rise?  are there any sub-sectors that are growing?where are the jobs? which places have the most medical office...}"
"host","{tips for medical office manager interviews.|do you have any tips to help prepare for an upcoming medical office manager interview?are there common interview questions that come up again and...}"
"host","{what are the best medical office manager qualifications and training to get ahead?|what is the best training for becoming a medical office manager? what types of ongoing training or certifications are necessary to be an effective...}"
