"&nbsp;&nbsp;","&nbsp;22 oz barn swallow stein&nbsp;","&nbsp;$20.00&nbsp;","&nbsp;"
"&nbsp;&nbsp;","&nbsp;barn swallow 6 inch framed tile&nbsp;","&nbsp;$15.50&nbsp;","&nbsp;"
"&nbsp;&nbsp;","&nbsp;barn swallow keepsake box&nbsp;","&nbsp;$26.00&nbsp;","&nbsp;"
"&nbsp;&nbsp;","&nbsp;barn swallow plush toy&nbsp;","&nbsp;$11.50&nbsp;","&nbsp;"
"&nbsp;&nbsp;","&nbsp;barn swallow satin shoulder bag&nbsp;","{$38.00|$30.00}","&nbsp;"
"&nbsp;&nbsp;","&nbsp;barn swallow street sign&nbsp;","&nbsp;$25.00&nbsp;","&nbsp;"
"&nbsp;&nbsp;","&nbsp;bluebird street sign&nbsp;","&nbsp;$25.00&nbsp;","&nbsp;"
"&nbsp;&nbsp;","&nbsp;naumann's barn swallow men's t-shirt&nbsp;","&nbsp;$22.00&nbsp;","&nbsp;"
"&nbsp;&nbsp;","&nbsp;naumann's ladies t-shirt&nbsp;","&nbsp;$22.00&nbsp;","&nbsp;"
"&nbsp;&nbsp;","&nbsp;peterson barn swallow mens t-shirt&nbsp;","&nbsp;$22.00&nbsp;","&nbsp;"
"&nbsp;&nbsp;","&nbsp;peterson ladies v-neck t-shirt&nbsp;","&nbsp;$22.00&nbsp;","&nbsp;"
"&nbsp;&nbsp;","&nbsp;r.b's barn swallow ladies v-neck t-shirt&nbsp;","&nbsp;$22.00&nbsp;","&nbsp;"
"&nbsp;&nbsp;","&nbsp;rb's barn swallow mens t-shirt&nbsp;","&nbsp;$22.00&nbsp;","&nbsp;"
"&nbsp;&nbsp;","&nbsp;swallow stained glass suncatcher&nbsp;","&nbsp;$21.00&nbsp;","&nbsp;"
"&nbsp;&nbsp;","&nbsp;tree swallow plush toy&nbsp;","&nbsp;$11.50&nbsp;","&nbsp;"
"&nbsp;&nbsp;","&nbsp;tree swallow street sign&nbsp;","&nbsp;$25.00&nbsp;","&nbsp;"
"&nbsp;&nbsp;","&nbsp;tree swallow wind spinner&nbsp;","&nbsp;$45.25&nbsp;","&nbsp;"
