"Method","List Name","Description"
"","Airport Issues","Updates relating to issues with the Ft. Lauderdale Airport Expansion"
"","CRA","CRA News."
"","Dania Beach Happenings","A page with news about project that the city is working on in and around Dania Beach"
"","e-Government Forms","Be notified when online forms are added."
"","New Commission Agenda & Minutes Available","This list will notify you of when a new commission special or work shop agenda and minutes are available and a link to it."
"","P&Z Agendas and Minutes","NULL"
"","Parks & Recreation Events","This list will notify you of changes to the Coming Parks & Recreations Events Page."
"","Road Improvements","This list will notify you of new additions to the Road Improvements Page."
"","Special Projects","This list will notify you of changes to the Special Projects Page."
